{
  "schema_version": "valp-agent-sessions.v1",
  "task_id": "TASK-001",
  "adapter": "herdr",
  "status": "ready",
  "bindings": {
    "example-agent": {
      "agent": "example-agent",
      "session_name": "valp-0123456789abcdef-example-agent",
      "generation": 1,
      "ownership": {
        "scope": "task",
        "task_id": "TASK-001",
        "project_identity": "sha256:0000000000000000000000000000000000000000000000000000000000000000"
      },
      "context": {"cwd": "/workspace/project"},
      "launch": {"argv": ["/opt/agents/bin/example-agent"]},
      "focused_at_provisioning": false,
      "runtime_scope": {
        "kind": "workspace",
        "ownership": "task",
        "workspace_id": "workspace-owned-1",
        "label": "valp-task-001-example-agent-g1"
      },
      "runtime_identity": {
        "pane_id": "pane-owned-1",
        "terminal_id": "terminal-owned-1",
        "workspace_id": "workspace-owned-1",
        "tab_id": "tab-owned-1",
        "token": "sha256:306c81a1f20c7cf884637ad90725ae718c17e1d9bb811d5064fffd9d068e25f0"
      },
      "lifecycle": "provisioned",
      "dispatch_eligible": true
    }
  },
  "updated_at": "2026-07-25T12:00:00Z"
}
